{
  "$defs": {
    "actor": {
      "additionalProperties": false,
      "properties": {
        "actorId": {
          "minLength": 1,
          "type": "string"
        },
        "actorType": {
          "enum": [
            "human",
            "agent",
            "kernel"
          ]
        }
      },
      "required": [
        "actorType",
        "actorId"
      ],
      "type": "object"
    },
    "exclusionRef": {
      "additionalProperties": false,
      "properties": {
        "$exclusion": {
          "$ref": "#/$defs/id"
        }
      },
      "required": [
        "$exclusion"
      ],
      "type": "object"
    },
    "gapRef": {
      "additionalProperties": false,
      "properties": {
        "$gap": {
          "$ref": "#/$defs/id"
        }
      },
      "required": [
        "$gap"
      ],
      "type": "object"
    },
    "id": {
      "pattern": "^[a-z0-9][a-z0-9._:-]*$",
      "type": "string"
    },
    "provenance": {
      "additionalProperties": false,
      "properties": {
        "extractedAt": {
          "type": "string"
        },
        "extractor": {
          "type": "string"
        },
        "locator": {
          "type": "string"
        },
        "sourceArtifact": {
          "type": "string"
        }
      },
      "required": [
        "sourceArtifact",
        "locator",
        "extractor",
        "extractedAt"
      ],
      "type": "object"
    },
    "timestamp": {
      "pattern": "^\\d{4}-\\d{2}-\\d{2}(T\\d{2}:\\d{2}:\\d{2}(\\.\\d+)?Z)?$",
      "type": "string"
    }
  },
  "$id": "https://docket.offgriddevices.com/schema/Model.schema.json",
  "$schema": "https://json-schema.org/draft/2020-12/schema",
  "additionalProperties": false,
  "description": "",
  "properties": {
    "confidence": {
      "enum": [
        "explicit",
        "inferred",
        "absent"
      ]
    },
    "createdAt": {
      "$ref": "#/$defs/timestamp"
    },
    "createdBy": {
      "$ref": "#/$defs/actor"
    },
    "definition": {
      "additionalProperties": false,
      "properties": {
        "containerDigest": {
          "type": "string"
        },
        "kind": {
          "enum": [
            "code",
            "lookup",
            "rpc",
            "rubric",
            "simulation"
          ]
        },
        "version": {
          "type": "string"
        }
      },
      "required": [
        "kind",
        "version"
      ],
      "type": "object"
    },
    "id": {
      "$ref": "#/$defs/id"
    },
    "ingestionProvenance": {
      "$ref": "#/$defs/provenance"
    },
    "inputs": {
      "items": {
        "$ref": "#/$defs/id"
      },
      "type": "array"
    },
    "intendedUse": {
      "type": "string"
    },
    "limitations": {
      "items": {
        "additionalProperties": false,
        "properties": {
          "justification": {
            "oneOf": [
              {
                "type": "string"
              },
              {
                "$ref": "#/$defs/exclusionRef"
              },
              {
                "$ref": "#/$defs/gapRef"
              }
            ]
          },
          "statement": {
            "type": "string"
          }
        },
        "required": [
          "statement",
          "justification"
        ],
        "type": "object"
      },
      "type": "array"
    },
    "name": {
      "type": "string"
    },
    "outputs": {
      "items": {
        "$ref": "#/$defs/id"
      },
      "type": "array"
    },
    "qualificationStatus": {
      "enum": [
        "draft",
        "validated",
        "qualified"
      ]
    },
    "questionClass": {
      "enum": [
        "desired-characteristics",
        "force-structure",
        "operational-concept",
        "combat-effectiveness",
        "cost",
        "schedule",
        "industrial-base",
        "requirements-tradeoff",
        "capability-gap",
        "other"
      ]
    },
    "rev": {
      "minimum": 1,
      "type": "integer"
    },
    "supersedes": {
      "$ref": "#/$defs/id"
    },
    "type": {
      "const": "Model"
    },
    "validityRegions": {
      "additionalProperties": true,
      "type": "object"
    },
    "vvaRecord": {
      "oneOf": [
        {
          "$ref": "#/$defs/id"
        },
        {
          "$ref": "#/$defs/exclusionRef"
        },
        {
          "$ref": "#/$defs/gapRef"
        }
      ]
    }
  },
  "required": [
    "id",
    "type",
    "rev",
    "createdBy",
    "createdAt",
    "name",
    "definition",
    "intendedUse",
    "questionClass",
    "vvaRecord",
    "qualificationStatus"
  ],
  "title": "Model",
  "type": "object"
}
