{
  "confidence": "explicit",
  "createdAt": "2021-05-01T00:00:00Z",
  "createdBy": {
    "actorId": "shreyash",
    "actorType": "human"
  },
  "definition": {
    "kind": "simulation",
    "version": "unversioned in the public description"
  },
  "id": "mdl-lbc",
  "ingestionProvenance": {
    "extractedAt": "2026-09-05T00:00:00Z",
    "extractor": "human",
    "locator": "printed p. 13 (PDF p. 18)",
    "sourceArtifact": "sources/gao-21-460-tactical-wheeled-vehicles-accessible.pdf"
  },
  "intendedUse": "simulates the consumption and distribution of all classes of supply at either the platform level or the unit level",
  "limitations": [
    {
      "justification": {
        "$gap": "gap-vva-lbc"
      },
      "statement": "The model requires extensive data inputs from various sources (printed p. 13)."
    }
  ],
  "name": "Logistics Battle Command model",
  "qualificationStatus": "validated",
  "questionClass": "capability-gap",
  "rev": 1,
  "type": "Model",
  "vvaRecord": "vva-lbc"
}
